{
  "prediction_id": null,
  "batch_id": "BATCH_ID",
  "station_id": "Station_1",
  "prediction_time": "2026-06-16T10:00:00+08:00",
  "predicted_ok_rate": 88.5,
  "predicted_ng_count": 22,
  "quality_score": 87.0,
  "risk_level": "medium",
  "model_input_source": "sensor_1min;sensor_3min;batch_run",
  "created_at": null
}